{
    "abilities": [
        {"name": "Strength","abilityImprovements": 0,"baseScore": 12,"miscBonus": 0},
        {"name": "Dexterity","abilityImprovements": 1,"baseScore": 15,"miscBonus": 0},
        {"name": "Constitution","abilityImprovements": 0,"baseScore": 13,"miscBonus": 0},
        {"name": "Intelligence","abilityImprovements": 0,"baseScore": 10,"miscBonus": 0},
        {"name": "Wisdom","abilityImprovements": 0,"baseScore": 14,"miscBonus": 0},
        {"name": "Charisma","abilityImprovements": 0,"baseScore": 8,"miscBonus": 0}
    ],
    "alignment": "Neutral Good",
    "class": {
        "name": "Monk",
        "subclass": {
            "name": "Open Hand"
        }
    },
    "feats": ["Athlete"],
    "inventory": {
        "backpack": ["Bedroll","Mess Kit","Rations (10 days)","Rope, Hempen (50 feet)","Tinderbox","Torch","Waterskin"],
        "equipped": ["Shortbow","Quarterstaff","Dart","Vials of Poison (2)","Shifting Map"],
        "magicItems": [
            {
                "name": "Goat Staff +1",
                "description": "3d6 bludgeoning damage per turn if Goblin",
                "rarity": "uncommon",
                "requiresAttunement": true,
                "type": "Wondrous item"
            },
            {
                "name": "Potion of Healing",
                "quantity": 1,
                "rarity": "common"
            },
            {
                "name": "Potion of Healing",
                "quantity": 2,
                "rarity": "uncommon"
            },
            {
                "name": "Ring of Protection"
            },
            {
                "name": "Ring of Spell Storing",
                "spell": "Command"
            },
            {
                "name": "Spell Scroll",
                "spell": "Darkness"
            },
            {
                "name": "Staff of Mag +1",
                "description": "+1 staff",
                "rarity": "uncommon",
                "requiresAttunement": true,
                "type": "Wondrous item"
            },
            {
                "name": "Transcendent Skull",
                "description": "unknown",
                "rarity": "uncommon",
                "requiresAttunement": true,
                "type": "Wondrous item"
            }
        ],
        "gold": 400
    },
    "languages": ["Halfling", "Infernal"],
    "level": 4,
    "name": "Zareth Stonestride",
    "race": {
        "name": "Half-Orc"
    },
    "rules": "5e",
    "skillProficiencies": ["Acrobatics","Insight","Medicine","Religion"]
}