{
    "abilities": [
        {"name": "Strength","abilityImprovements": 0,"baseScore": 8,"miscBonus": 0},
        {"name": "Dexterity","abilityImprovements": 0,"baseScore": 14,"miscBonus": 0},
        {"name": "Constitution","abilityImprovements": 0,"baseScore": 15,"miscBonus": 0},
        {"name": "Intelligence","abilityImprovements": 0,"baseScore": 10,"miscBonus": 0},
        {"name": "Wisdom","abilityImprovements": 0,"baseScore": 14,"miscBonus": 0},
        {"name": "Charisma","abilityImprovements": 0,"baseScore": 10,"miscBonus": 0}
    ],
    "alignment": "Chaotic Good",
    "class": {
        "name": "Rogue",
        "expertise": ["Sleight of Hand","Thieves' Tools"],
        "subclass": {
            "name": "Thief"
        }
    },
    "inventory": {
        "backpack": ["Crowbar","Dice Set","Playing Card Set","Forgery Kit","Piton","Rations (5 days)","Thieves' Tools","Tinderbox","Torch","Waterskin"],
        "equipped": ["Arrows","Studded Leather","Crossbow, hand","Shortsword","Shortsword","Thieves' Tools"],
        "gold": 10
    },
    "languages": ["Goblin","Orc"],
    "level": 3,
    "name": "Seraphina",
    "race": {
        "name": "Halfling",
        "subrace": {
            "name": "Stout Halfling"
        }
    },
    "skillProficiencies": ["Acrobatics","Deception","Investigation","Perception","Sleight of Hand","Stealth"]
}