{
    "abilities": [
        { "name": "Strength", "abilityImprovements": 0, "baseScore": 8, "miscBonus": 0 },
        { "name": "Dexterity", "abilityImprovements": 0, "baseScore": 10, "miscBonus": 0 },
        { "name": "Constitution", "abilityImprovements": 0, "baseScore": 14, "miscBonus": 0 },
        { "name": "Intelligence", "abilityImprovements": 0, "baseScore": 15, "miscBonus": 0 },
        { "name": "Wisdom", "abilityImprovements": 0, "baseScore": 14, "miscBonus": 0 },
        { "name": "Charisma", "abilityImprovements": 0, "baseScore": 10, "miscBonus": 0 }
    ],
    "alignment": "Neutral Good",
    "class": {
        "name": "Wizard",
        "subclass": {
            "name": "Evocation"
        }
    },
    "inventory": {
        "backpack": ["Blanket","Case,Map or Scroll","Fishing Tackle","Grappling Hook","Ink (4, 1 oz bottles)","Ink Pens (2)","Parchment (20 sheets)","Playing Card Set","Rations (5 days)","Rope, Silk (50 feet)","String","Waterskin"],
        "equipped": ["Quarterstaff","Dagger"],
        "gold": 10
    },
    "level": 20,
    "name": "Wizard",
    "race": {
        "name": "Wizard",
        "subrace": {
            "name": "High Elf"
        }
    },
    "skillProficiencies": ["Arcana","History","Investigation","Medicine","Perception"],
    "spells": ["Burning Hands","Detect Magic","Disguise Self","Find Familiar","Fire Bolt","Mage Hand","Magic Missile","Minor Illusion","Shield","Shocking Grasp"],
    "rules": "2024"
}