{
    "abilities": [
        {"name": "Strength","abilityImprovements": 2,"baseScore": 14,"miscBonus": 0},
        {"name": "Dexterity","abilityImprovements": 0,"baseScore": 10,"miscBonus": 0},
        {"name": "Constitution","abilityImprovements": 0,"baseScore": 14,"miscBonus": 0},
        {"name": "Intelligence","abilityImprovements": 0,"baseScore": 8,"miscBonus": 0},
        {"name": "Wisdom","abilityImprovements": 0,"baseScore": 12,"miscBonus": 0},
        {"name": "Charisma","abilityImprovements": 0,"baseScore": 14,"miscBonus": 0}
    ],
    "alignment": "Lawful Good",
    "class": {
        "name": "Paladin",
        "fightingStyles": ["Defense"],
        "subclass": {
            "name": "Vengeance"
        }
    },
    "inventory": {
        "backpack": ["Bedroll","Light Hammer","Mess Kit","Rations (10 days)","Rope, Hempen (50 feet)","Tinderbox","Torch","Waterskin"],
        "equipped": ["Plate","Crossbow, heavy","+1 Greataxe","Dagger","Holy Symbol"],
        "magicItems": [
            {
                "name": "Clockwork Amulet",
                "description": "Add +10 to d20 once per day",
                "rarity": "uncommon",
                "requiresAttunement": false,
                "type": "Wondrous item"
            },
            {
                "name": "Potion of Healing",
                "quantity": 1,
                "rarity": "common"
            },
            {
                "name": "Veterans Cane",
                "description": "+1 longsword disguised as a cane",
                "rarity": "uncommon",
                "requiresAttunement": false,
                "type": "Wondrous item"
            }
        ],
        "gold": 25
    },
    "languages": ["Elvish"],
    "level": 4,
    "name": "Valerius Stormscale",
    "race": {
        "name": "Dragonborn",
        "type": "Gold"
    },
    "skillProficiencies": ["Athletics","History","Intimidation","Persuasion"]
}