{
    "abilities": [
        {"name": "Strength","abilityImprovements": 0,"baseScore": 8,"miscBonus": 0},
        {"name": "Dexterity","abilityImprovements": 0,"baseScore": 13,"miscBonus": 0},
        {"name": "Constitution","abilityImprovements": 0,"baseScore": 14,"miscBonus": 0},
        {"name": "Intelligence","abilityImprovements": 0,"baseScore": 10,"miscBonus": 0},
        {"name": "Wisdom","abilityImprovements": 0,"baseScore": 15,"miscBonus": 0},
        {"name": "Charisma","abilityImprovements": 0,"baseScore": 12,"miscBonus": 0}
    ],
    "alignment": "Neutral Good",
    "class": {
        "name": "Druid",
        "subclass": {
            "name": "Land",
            "type": "Forest"
        }
    },
    "inventory": {
        "backpack": ["Mess Kit","Playing Card Set","Rations (5 days)","Rope, Silk (50 feet)","Small Knife","Tinderbox","Torch","Totem","Waterskin"],
        "equipped": ["Cloak of Elvenkind","Leather","Longbow","Scimitar","Dagger"],
        "gold": 30
    },
    "languages": ["Sylvan"],
    "level": 20,
    "name": "Druid",
    "race": {
        "name": "Elf",
        "subrace": {
            "name": "Wood Elf"
        }
    },
    "skillProficiencies": ["Animal Handling","Insight","Nature","Nature","Stealth"],
    "spells": ["Guidance","Mending","Produce Flame","Shocking Grasp"],
    "rules": "5e"
}