{
    "abilities": [
        { "name": "Strength", "abilityImprovements": 0, "baseScore": 10, "miscBonus": 0 },
        { "name": "Dexterity", "abilityImprovements": 0, "baseScore": 15, "miscBonus": 0 },
        { "name": "Constitution", "abilityImprovements": 0, "baseScore": 12, "miscBonus": 0 },
        { "name": "Intelligence", "abilityImprovements": 0, "baseScore": 9, "miscBonus": 0 },
        { "name": "Wisdom", "abilityImprovements": 0, "baseScore": 11, "miscBonus": 0 },
        { "name": "Charisma", "abilityImprovements": 0, "baseScore": 14, "miscBonus": 0 }
    ],
    "alignment": "Neutral Good",
    "class": {
        "name": "Bard",
        "expertise": ["Performance","Persuasion"],
        "subclass": {
            "name": "Lore"
        }
    },
    "inventory": {
        "backpack": ["Fishing Tackle","Grappling Hook","Playing Card Set","Rations (5 days)","Rope, Silk (50 feet)","String","Waterskin"],
        "equipped": ["Studded Leather","Crossbow, hand","Rapier","Dagger"],
        "gold": 10
    },
    "level": 20,
    "name": "Bard",
    "race": {
        "name": "Dragonborn",
        "subrace": {
            "name": "Black"
        }
    },
    "resistances": ["Fire"],
    "skillProficiencies": ["Insight","Performance","Perception","Persuasion","Deception"],
    "spells": ["Charm Person","Disguise Self","Hideous Laughter","Mage Hand","Minor Illusion","Sleep"],
    "rules": "2024"
}