{
    "abilities": [
        { "name": "Strength", "abilityImprovements": 0, "baseScore": 15, "miscBonus": 0 },
        { "name": "Dexterity", "abilityImprovements": 0, "baseScore": 12, "miscBonus": 0 },
        { "name": "Constitution", "abilityImprovements": 0, "baseScore": 15, "miscBonus": 0 },
        { "name": "Intelligence", "abilityImprovements": 0, "baseScore": 9, "miscBonus": 0 },
        { "name": "Wisdom", "abilityImprovements": 0, "baseScore": 11, "miscBonus": 0 },
        { "name": "Charisma", "abilityImprovements": 0, "baseScore": 9, "miscBonus": 0 }
    ],
    "alignment": "Neutral Good",
    "class": {
        "name": "Barbarian",
        "subclass": {
            "name": "Berserker"
        }
    },
    "inventory": {
        "backpack": ["Fishing Tackle","Grappling Hook","Playing Card Set","Rations (5 days)","Rope, Silk (50 feet)","String","Waterskin"],
        "equipped": ["Longbow","Greatsword","Dagger"],
        "gold": 10
    },
    "level": 20,
    "name": "Barbarian",
    "race": {
        "name": "Human",
        "subrace": {
            "name": "Human"
        }
    },
    "skillProficiencies": ["Athletics","Intimidation","Perception","Survival"],
    "rules": "2024"
}