{
    "abilities": [
        {"name": "Strength","abilityImprovements": 0,"baseScore": 14,"miscBonus": 0},
        {"name": "Dexterity","abilityImprovements": 0,"baseScore": 10,"miscBonus": 0},
        {"name": "Constitution","abilityImprovements": 0,"baseScore": 14,"miscBonus": 0},
        {"name": "Intelligence","abilityImprovements": 0,"baseScore": 8,"miscBonus": 0},
        {"name": "Wisdom","abilityImprovements": 0,"baseScore": 12,"miscBonus": 0},
        {"name": "Charisma","abilityImprovements": 0,"baseScore": 14,"miscBonus": 0}
    ],
    "alignment": "Lawful Good",
    "class": {
        "name": "Paladin",
        "fightingStyles": ["Defense"],
        "subclass": {
            "name": "Vengeance"
        }
    },
    "inventory": {
        "backpack": ["Bedroll","Light Hammer","Mess Kit","Rations (10 days)","Rope, Hempen (50 feet)","Tinderbox","Torch","Waterskin"],
        "equipped": ["Chain Mail","Shield","Crossbow, heavy","Longsword","Dagger"],
        "gold": 25
    },
    "languages": ["Elvish"],
    "level": 20,
    "name": "Ramus",
    "race": {
        "name": "Dragonborn",
        "type": "Gold"
    },
    "skillProficiencies": ["Athletics","History","Intimidation","Persuasion"]
}