{
    "abilities": [
        { "name": "Strength", "abilityImprovements": 0, "baseScore": 8, "miscBonus": 0 },
        { "name": "Dexterity", "abilityImprovements": 0, "baseScore": 12, "miscBonus": 0 },
        { "name": "Constitution", "abilityImprovements": 0, "baseScore": 15, "miscBonus": 1 },
        { "name": "Intelligence", "abilityImprovements": 0, "baseScore": 10, "miscBonus": 0 },
        { "name": "Wisdom", "abilityImprovements": 0, "baseScore": 13, "miscBonus": 1 },
        { "name": "Charisma", "abilityImprovements": 0, "baseScore": 14, "miscBonus": 0 }
    ],
    "alignment": "Neutral Good",
    "class": {
        "name": "Warlock",
        "subclass": {
            "name": "The Archfey"
        },
        "arcanums": ["Conjure Fey"],
        "invocations": ["Agonizing Blast","Mask of Many Faces"],
        "pactBoon": "Tome"
    },
    "inventory": {
        "backpack": ["Blanket","Case,Map or Scroll","Fishing Tackle","Grappling Hook","Ink (4, 1 oz bottles)","Ink Pens (2)","Parchment (20 sheets)","Playing Card Set","Rations (5 days)","Rope, Silk (50 feet)","String","Waterskin"],
        "equipped": ["Quarterstaff","Dagger"],
        "gold": 10
    },
    "level": 20,
    "name": "Warlock",
    "race": {
        "name": "Tiefling",
        "subrace": {
            "name": "Abyssal"
        }
    },
    "skillProficiencies": ["Arcana","Insight","Investigation","Perception","Nature","Survival"],
    "spells": ["Charm Person","Eldritch Blast","Hellish Rebuke","Mage Hand"],
    "rules": "2024"
}