{
    "abilities": [
        { "name": "Strength", "abilityImprovements": 0, "baseScore": 14, "miscBonus": 0 },
        { "name": "Dexterity", "abilityImprovements": 0, "baseScore": 14, "miscBonus": 0 },
        { "name": "Constitution", "abilityImprovements": 0, "baseScore": 15, "miscBonus": 0 },
        { "name": "Intelligence", "abilityImprovements": 0, "baseScore": 8, "miscBonus": 0 },
        { "name": "Wisdom", "abilityImprovements": 0, "baseScore": 10, "miscBonus": 0 },
        { "name": "Charisma", "abilityImprovements": 0, "baseScore": 10, "miscBonus": 0 }
    ],
    "alignment": "Neutral Good",
    "class": {
        "name": "Barbarian",
        "subclass": {
            "name": "Berserker"
        }
    },
    "inventory": {
        "backpack": ["Fishing Tackle","Grappling Hook","Playing Card Set","Rations (5 days)","Rope, Silk (50 feet)","String","Waterskin"],
        "equipped": ["Arrows (10)","Greataxe","Longbow"],
        "gold": 30
    },
    "languages": ["Goblin","Orc","Uncommon"],
    "level": 2,
    "name": "Vexna",
    "race": {
        "name": "Half-Orc"
    },
    "rules": "2024",
    "skillProficiencies": ["Acrobatics","Athletics","Intimidation","Perception","Performance"]
}