{
    "abilities": [
        {"name": "Strength","abilityImprovements": 0,"baseScore": 8,"miscBonus": 0},
        {"name": "Dexterity","abilityImprovements": 0,"baseScore": 13,"miscBonus": 0},
        {"name": "Constitution","abilityImprovements": 0,"baseScore": 13,"miscBonus": 1},
        {"name": "Intelligence","abilityImprovements": 0,"baseScore": 10,"miscBonus": 0},
        {"name": "Wisdom","abilityImprovements": 0,"baseScore": 15,"miscBonus": 1},
        {"name": "Charisma","abilityImprovements": 0,"baseScore": 12,"miscBonus": 0}
    ],
    "alignment": "Neutral Good",
    "class": {
        "name": "Druid",
        "subclass": {
            "name": "Land",
            "type": "Forest"
        }
    },
    "inventory": {
        "backpack": ["Mess Kit","Playing Card Set","Rations (5 days)","Rope, Silk (50 feet)","Small Knife","Tinderbox","Torch","Totem","Waterskin"],
        "equipped": ["Leather","Quarterstaff","Dagger","Crossbow, light"],
        "gold": 30
    },
    "languages": ["Abyssal","Dwarvish","Giant"],
    "level": 2,
    "name": "Xandria",
    "race": {
        "name": "Half-Elf"
    },
    "rules": "5e",
    "skillProficiencies": ["Animal Handling","Arcana","History","Medicine","Nature","Nature","Survival"],
    "spells": ["Guidance","Produce Flame"]
}