{
    "abilities": [
        {"name": "Strength","abilityImprovements": 0,"baseScore": 10,"miscBonus": 0},
        {"name": "Dexterity","abilityImprovements": 0,"baseScore": 15,"miscBonus": 1},
        {"name": "Constitution","abilityImprovements": 0,"baseScore": 14,"miscBonus": 0},
        {"name": "Intelligence","abilityImprovements": 0,"baseScore": 12,"miscBonus": 0},
        {"name": "Wisdom","abilityImprovements": 0,"baseScore": 13,"miscBonus": 1},
        {"name": "Charisma","abilityImprovements": 0,"baseScore": 8,"miscBonus": 0}
    ],
    "alignment": "Chaotic Good",
    "class": {
        "name": "Rogue",
        "expertise": ["Sleight of Hand","Thieves' Tools"],
        "subclass": {
            "name": "Thief"
        }
    },
    "inventory": {
        "backpack": ["Crowbar","Dice Set","Playing Card Set","Forgery Kit","Piton","Rations (5 days)","Thieves' Tools","Tinderbox","Torch","Waterskin"],
        "equipped": ["Arrows","Studded Leather","Crossbow, hand","Shortsword","Shortsword","Thieves' Tools"],
        "gold": 10
    },
    "level": 1,
    "name": "Rogue",
    "race": {
        "name": "Half-Elf"
    },
    "skillProficiencies": ["Acrobatics","Athletics","Deception","Insight","Investigation","Perception","Sleight of Hand","Stealth"],
    "rules": "2024"
}