{
    "abilities": [
        {"name": "Strength","abilityImprovements": 0,"baseScore": 12,"miscBonus": 0},
        {"name": "Dexterity","abilityImprovements": 0,"baseScore": 15,"miscBonus": 0},
        {"name": "Constitution","abilityImprovements": 0,"baseScore": 13,"miscBonus": 0},
        {"name": "Intelligence","abilityImprovements": 0,"baseScore": 10,"miscBonus": 0},
        {"name": "Wisdom","abilityImprovements": 0,"baseScore": 14,"miscBonus": 0},
        {"name": "Charisma","abilityImprovements": 0,"baseScore": 8,"miscBonus": 0}
    ],
    "alignment": "Neutral Good",
    "class": {
        "name": "Monk",
        "subclass": {
            "name": "Open Hand"
        }
    },
    "inventory": {
        "backpack": ["Potion of Healing (2)","Bedroll","Mess Kit","Rations (10 days)","Rope, Hempen (50 feet)","Tinderbox","Torch","Waterskin"],
        "equipped": ["Quarterstaff","Dart"],
        "gold": 400
    },
    "languages": ["Halfling", "Infernal"],
    "level": 1,
    "name": "Monk",
    "race": {
        "name": "Human",
        "subrace": {
            "name": "Human"
        }
    },
    "skillProficiencies": ["Acrobatics","Insight","Medicine","Religion"],
    "rules": "2024"
}