{
    "abilities": [
        {"name": "Strength","abilityImprovements": 0,"baseScore": 14,"miscBonus": 5},
        {"name": "Dexterity","abilityImprovements": 0,"baseScore": 8,"miscBonus": 0},
        {"name": "Constitution","abilityImprovements": 0,"baseScore": 14,"miscBonus": 0},
        {"name": "Intelligence","abilityImprovements": 0,"baseScore": 10,"miscBonus": 0},
        {"name": "Wisdom","abilityImprovements": 2,"baseScore": 15,"miscBonus": 0},
        {"name": "Charisma","abilityImprovements": 0,"baseScore": 10,"miscBonus": 0}
    ],
    "alignment": "Neutral Good",
    "class": {
        "name": "Cleric",
        "subclass": {
            "name": "Life"
        }
    },
    "inventory": {
        "backpack": ["Mess Kit","Minerals","Playing Card Set","Rations (5 days)","Rope, Silk (50 feet)","Small Knife","Tinderbox","Torch","Waterskin"],
        "equipped": ["Arrows","Chain Mail","Holy Symbol","Longbow","+1 Mace","Shield"],
        "magicItems": [
            {
                "name": "Gauntlets of Ogre Power"
            },
            {
                "name": "Lightbringer Mace +1",
                "description": "Adds 1d6 radiant damage and allows for illumination of a 20' radius around the weilder",
                "rarity": "rare",
                "requiresAttunement": true,
                "type": "Weapon (mace)"
            },
            {
                "name": "Potion of Healing",
                "quantity": 1,
                "rarity": "common"
            }
        ],
        "gold": 10
    },
    "languages": ["Celestial","Dwarvish"],
    "level": 4,
    "name": "Valena",
    "race": {
        "name": "Elf",
        "subrace": {
            "name": "Wood Elf"
        }
    },
    "rules": "5e",
    "skillProficiencies": ["Animal Handling","Insight","Medicine","Survival"],
    "spells": ["Aid","Detect Magic","Guidance","Guiding Bolt","Healing Word","Hold Person","Inflict Wounds","Prayer of Healing","Sacred Flame","Spare the Dying"]
}