{
    "abilities": [
        { "name": "Strength", "abilityImprovements": 0, "baseScore": 12, "miscBonus": 0 },
        { "name": "Dexterity", "abilityImprovements": 0, "baseScore": 15, "miscBonus": 0 },
        { "name": "Constitution", "abilityImprovements": 0, "baseScore": 15, "miscBonus": 0 },
        { "name": "Intelligence", "abilityImprovements": 0, "baseScore": 9, "miscBonus": 0 },
        { "name": "Wisdom", "abilityImprovements": 0, "baseScore": 11, "miscBonus": 0 },
        { "name": "Charisma", "abilityImprovements": 0, "baseScore": 9, "miscBonus": 0 }
    ],
    "alignment": "Neutral Good",
    "class": {
        "name": "Fighter",
        "fightingStyles": ["Archery"],
        "subclass": {
            "name": "Eldritch Knight",
            "maneuvers": ["Parry","Riposte","Sweeping Attack"]
        }
    },
    "inventory": {
        "backpack": ["Fishing Tackle","Grappling Hook","Playing Card Set","Rations (5 days)","Rope, Silk (50 feet)","String","Waterskin"],
        "equipped": ["Chain Mail","Longbow","Scimitar","Scimitar"],
        "gold": 10
    },
    "level": 20,
    "name": "Fighter",
    "race": {
        "name": "Gnome",
        "subrace": {
            "name": "Forest Gnome"
        }
    },
    "skillProficiencies": ["Athletics","Intimidation","Perception","Survival"],
    "spells": ["Detect Magic","Guidance","Guiding Bolt","Healing Word","Inflict Wounds","Sacred Flame","Spare the Dying"],
    "rules": "5e"
}