{
    "abilities": [
        { "name": "Strength", "abilityImprovements": 0, "baseScore": 8, "miscBonus": 0 },
        { "name": "Dexterity", "abilityImprovements": 0, "baseScore": 13, "miscBonus": 0 },
        { "name": "Constitution", "abilityImprovements": 0, "baseScore": 14, "miscBonus": 1 },
        { "name": "Intelligence", "abilityImprovements": 0, "baseScore": 15, "miscBonus": 1 },
        { "name": "Wisdom", "abilityImprovements": 0, "baseScore": 12, "miscBonus": 0 },
        { "name": "Charisma", "abilityImprovements": 0, "baseScore": 10, "miscBonus": 0 }
    ],
    "alignment": "Lawful Good",
    "class": {
        "name": "Wizard",
        "subclass": {
            "name": "Divination"
        }
    },
    "feats": ["War Caster"],
    "inventory": {
        "backpack": ["Bedroll","Mess Kit","Rations (10 days)","Rope, Hempen (50 feet)","Tinderbox","Torch","Waterskin"],
        "equipped": ["Quarterstaff","Crossbow, light"],
        "gold": 30
    },
    "languages": ["Draconic","Goblin","Orc"],
    "level": 2,
    "name": "Zeph",
    "race": {
        "name": "Human",
        "subrace": {
            "name": "Variant Human"
        }
    },
    "skillProficiencies": ["Investigation","Insight","Medicine","Perception","Religion"],
    "spells": ["Chill Touch","Dancing Lights","Feather Fall","Mage Hand","Charm Person","Detect Magic","Magic Missile","Sleep"]
}