{
    "abilities": [
        { "name": "Strength", "abilityImprovements": 0, "baseScore": 13, "miscBonus": 0 },
        { "name": "Dexterity", "abilityImprovements": 0, "baseScore": 9, "miscBonus": 0 },
        { "name": "Constitution", "abilityImprovements": 0, "baseScore": 14, "miscBonus": 2 },
        { "name": "Intelligence", "abilityImprovements": 0, "baseScore":9, "miscBonus": 0 },
        { "name": "Wisdom", "abilityImprovements": 0, "baseScore": 15, "miscBonus": 2 },
        { "name": "Charisma", "abilityImprovements": 0, "baseScore": 12, "miscBonus": 0 }
    ],
    "alignment": "Lawful Good",
    "class": {
        "name": "Cleric",
        "subclass": {
            "name": "Tempest"
        }
    },
    "feats": ["Resilient"],
    "inventory": {
        "backpack": ["Bedroll","Dice Set","Holy Symbol","Mess Kit","Rations (10 days)","Rope, Hempen (50 feet)","Tinderbox","Torch","Waterskin"],
        "equipped": ["Chain Mail","Crossbow Bolts","Crossbow, light","Shield","Warhammer","Dagger"],
        "gold": 30
    },
    "languages": ["Common","Dwarven"],
    "level": 2,
    "name": "Garrick",
    "race": {
        "name": "Human",
        "subrace": {
            "name": "Variant Human"
        }
    },
    "rules": "5e",
    "skillProficiencies": ["Athletics","Intimidation","Medicine","Perception","Religion"],
    "spells": ["Sacred Flame","Spare the Dying","Thaumaturgy","Bless","Command","Fog Cloud","Healing Word","Inflict Wounds","Sanctuary","Thunderwave"]
}