{
    "abilities": [
        {"name": "Strength","abilityImprovements": 0,"baseScore": 12,"miscBonus": 0},
        {"name": "Dexterity","abilityImprovements": 2,"baseScore": 15,"miscBonus": 0},
        {"name": "Constitution","abilityImprovements": 0,"baseScore": 15,"miscBonus": 0},
        {"name": "Intelligence","abilityImprovements": 0,"baseScore": 9,"miscBonus": 0},
        {"name": "Wisdom","abilityImprovements": 0,"baseScore": 11,"miscBonus": 0},
        {"name": "Charisma","abilityImprovements": 0,"baseScore": 9,"miscBonus": 0}
    ],
    "alignment": "Neutral Good",
    "class": {
        "name": "Fighter",
        "fightingStyles": ["Archery"],
        "subclass": {
            "name": "Champion"
        }
    },
    "inventory": {
        "backpack": ["Fishing Tackle","Grappling Hook","Playing Card Set","Rations (5 days)","Rope, Silk (50 feet)","String","Waterskin"],
        "equipped": ["Chain Mail","Longbow","Scimitar","Scimitar"],
        "magicItems": [
            {
                "name": "Boots of Striding and Springing"
            },
            {
                "name": "Potion of Healing",
                "quantity": 1,
                "rarity": "common"
            },
            {
                "name": "Spell Scroll",
                "spell": "Charm Person"
            },
            {
                "name": "Spell Scroll",
                "spell": "Fireball"
            }
        ],
        "gold": 10
    },
    "languages": ["Elvish"],
    "level": 4,
    "name": "Devin",
    "race": {
        "name": "Human",
        "subrace": {
            "name": "Human"
        }
    },
    "rules": "5e",
    "skillProficiencies": ["Athletics","Intimidation","Perception","Survival"]
}