{
    "abilities": [
        {"name": "Strength","abilityImprovements": 0,"baseScore": 12,"miscBonus": 0},
        {"name": "Dexterity","abilityImprovements": 0,"baseScore": 8,"miscBonus": 0},
        {"name": "Constitution","abilityImprovements": 1,"baseScore": 13,"miscBonus": 0},
        {"name": "Intelligence","abilityImprovements": 0,"baseScore": 14,"miscBonus": 0},
        {"name": "Wisdom","abilityImprovements": 0,"baseScore": 15,"miscBonus": 0},
        {"name": "Charisma","abilityImprovements": 0,"baseScore": 10,"miscBonus": 0}
    ],
    "alignment": "Neutral Good",
    "class": {
        "name": "Druid",
        "subclass": {
            "name": "Moon",
            "type": "Coast"
        }
    },
    "feats":["Resilient"],
    "inventory": {
        "backpack": ["Mess Kit","Playing Card Set","Rations (5 days)","Rope, Silk (50 feet)","Small Knife","Tinderbox","Torch","Waterskin"],
        "equipped": ["Arrows","Chain Shirt","Longbow","+1 Longsword","Healing Potion","Shield"],
        "magicItems": [
            {
                "name": "Loraleth's Cat",
                "description": "While wearing (Armor Class 11), the player has an Animal Handling advantage, however, the player also has an Intimidation and Stealth disadvantage. Once per short rest, the player can roll a d20 to Conjure Cats. If the roll is less than 10, one cat is conjured. If the roll is over 10, two cats are conjured. Cats live indefinitely. If cats are tamed, they can Scratch as an action, doing up to 1d4 slashing damage.",
                "rarity": "uncommon",
                "requiresAttunement": false,
                "type": "Wonderous Item"
            }
        ],
        "gold": 8
    },
    "languages": ["Celestial","Primordial","Undercommon"],
    "level": 4,
    "name": "Loraleth Fundraea",
    "race": {
        "name": "Elf",
        "subrace": {
            "name": "High Elf"
        }
    },
    "rules": "5e",
    "specialActions": [],
    "skillProficiencies": ["Animal Handling","Arcana","History","Nature"],
    "spells": ["Guidance","Mage Hand","Mending","Produce Flame"]
}