{
    "abilities": [
        {"name": "Strength","abilityImprovements": 0,"baseScore": 11,"miscBonus": 0},
        {"name": "Dexterity","abilityImprovements": 0,"baseScore": 16,"miscBonus": 1},
        {"name": "Constitution","abilityImprovements": 0,"baseScore": 13,"miscBonus": 1},
        {"name": "Intelligence","abilityImprovements": 0,"baseScore": 8,"miscBonus": 0},
        {"name": "Wisdom","abilityImprovements": 0,"baseScore": 14,"miscBonus": 0},
        {"name": "Charisma","abilityImprovements": 0,"baseScore": 10,"miscBonus": 0}
    ],
    "alignment": "Neutral Good",
    "class": {
        "name": "Ranger",
        "favoredEnemies": ["Humanoids"],
        "favoredTerrain": ["Forest"],
        "fightingStyles": ["Archery"],
        "subclass": {
            "name": "Beast Master"
        }
    },
    "inventory": {
        "backpack": ["Bedroll","Goodberry","Mess Kit","Rations (10 days)","Rope, Hempen (50 feet)","Tinderbox","Torch","Waterskin"],
        "equipped": ["Studded Leather","Longbow","Scimitar","Scimitar"],
        "magicItems": [
            {
                "name": "Ring of Protection",
                "bonus": "+1"
            },
            {
                "name": "Arrow of Ice",
                "quantity": 2
            },
            {
                "name": "Arrow of Fire",
                "quantity": 10
            }
        ],
        "gold": 10
    },
    "languages": ["Goblin","Orc"],
    "level": 3,
    "name": "Seraphina-Ranger",
    "race": {
        "name": "Half-Elf"
    },
    "skillProficiencies": ["Animal Handling","Insight","Investigation","Nature","Perception","Stealth","Survival"],
    "spells": ["Hail of Thorns","Hunter's Mark","Ensnaring Strike"]
}