{
    "abilities": [
        {"name": "Strength","abilityImprovements": 0,"baseScore": 8,"miscBonus": 0},
        {"name": "Dexterity","abilityImprovements": 0,"baseScore": 13,"miscBonus": 0},
        {"name": "Constitution","abilityImprovements": 0,"baseScore": 14,"miscBonus": 0},
        {"name": "Intelligence","abilityImprovements": 0,"baseScore": 10,"miscBonus": 0},
        {"name": "Wisdom","abilityImprovements": 0,"baseScore": 15,"miscBonus": 0},
        {"name": "Charisma","abilityImprovements": 0,"baseScore": 12,"miscBonus": 0}
    ],
    "alignment": "Neutral Good",
    "class": {
        "name": "Druid",
        "subclass": {
            "name": "Land",
            "type": "Forest"
        }
    },
    "feats": ["Moderately Armored"],
    "inventory": {
        "backpack": ["Mess Kit","Playing Card Set","Rations (5 days)","Rope, Silk (50 feet)","Scimitar","Small Knife","Tinderbox","Torch","Totem","Waterskin"],
        "equipped": ["+1 Breastplate","Longbow","Quarterstaff","Dagger"],
        "magicItems": [
            {
                "name": "Arrow of Fire",
                "quantity": 10
            },
            {
                "name": "Arrow of Ice",
                "quantity": 2
            },
            {
                "name": "Cloak of Elvenkind"
            },
            {
                "name": "Dragonguard Breastplate +1",
                "description": "Advantage on saving throws against dragon attacks",
                "rarity": "rare",
                "requiresAttunement": true,
                "type": "Armor (Breastplate)"
            },
            {
                "name": "Horn of Silent Alarm"
            },
            {
                "name": "Potion of Healing",
                "quantity": 1,
                "rarity": "common"
            }
        ],
        "gold": 30
    },
    "languages": ["Sylvan"],
    "level": 4,
    "name": "Lirael",
    "race": {
        "name": "Elf",
        "subrace": {
            "name": "Wood Elf"
        }
    },
    "rules": "5e",
    "skillProficiencies": ["Animal Handling","Insight","Nature","Nature","Stealth"],
    "spells": ["Druidcraft","Frostbite","Produce Flame","Shillelagh"]
}